date,title,description,coding
2024-11-21,Fyodor Lukyanov: Biden is trying to throw Trump under the Ukrainian bus,"The White House recognises that negotiations to end the conflict are inevitable, but it wants to delay the day of judgment.  Read Full Article at RT.com",
2024-11-21,[Removed],[Removed],
2024-11-21,[Removed],[Removed],
2024-11-21,"Grimes Says Elon Musk Has Become ""Unrecognizable""","Grime Time Claire ""Grimes"" Boucher is getting personal on Elon Musk's ""everything"" app as she opens up about how the right-wing billionaire has affected her and her art. The Canadian-born artist and mother to three of Musk's ever-growing litter of children su…",
2024-11-21,Bluesky Is The Twitter App You Always Wanted. Or Is It?,"For now, Bluesky has a clean interface and I like what I’m seeing. However, I can’t see myself becoming a diehard fan.",
2024-11-21,"Musk, Ramaswamy vow 'mass head-count reductions' in U.S. government (Washington Post)","Washington Post:
Musk, Ramaswamy vow ‘mass head-count reductions’ in U.S. government  —  The leaders of President-elect Donald Trump's new DOGE panel have promised extensive cuts to federal regulation, spending and personnel.  —  Elon Musk and Vivek Ramaswamy…",
2024-11-21,"Kim Kardashian's latest photoshoot with a Tesla bot sparks outrage. Not because it's spicy, but because Elon will probably call it ""AI synergy"" [Facepalm]","Kim Kardashian's latest photoshoot with a Tesla bot sparks outrage. Not because it's spicy, but because Elon will probably call it ""AI synergy""",
2024-11-21,[Removed],[Removed],
2024-11-21,Crypto Industry Bids Farewell to Gary Gensler—Exactly Like You’d Expect,"SEC Chair Gary Gensler's resignation announcement was met with a sigh of relief on Crypto Twitter, alongside a slew of mocking memes.",
2024-11-21,[Removed],[Removed],
2024-11-21,It's Easy to Find Your X (Twitter) Favorites on Bluesky. Here's How to Do It,"Millions of new users are jumping to Bluesky -- if you're one of them, you can find all your Twitter followers with this nifty Chrome extension.",
2024-11-21,Greene to Chair House DOGE Subcommittee,"Rep. Marjorie Taylor Greene hasn't landed a Cabinet job, but she says will be working with President-elect Trump, Elon Musk, and Vivek Ramaswamy during the next Congress. The Republican lawmaker says she will chair a House Oversight Committee subcommittee tha…",
2024-11-21,"Tesla CEO Elon Musk makes shock claim about Jeff Bezos, reigniting rivalry","Update: Jeff Bezos has said this is “100% not true.”
Nope. 100% not true.
— Jeff Bezos (@JeffBezos) November 21, 2024
Tesla CEO Elon Musk has made a shocking claim about former Amazon frontman Jeff Bezos, potentially reigniting their rivalry and bringing forw…",
2024-11-21,"After Illegal Immigrant Found Guilty Of Murder, Dems Sentence Him To Flying Coach","ATHENS, GA — Justice was finally served in the wake of an unspeakable tragedy, as after an illegal immigrant was found guilty of murdering an American citizen, Democrats sentenced him to only being allowed to fly coach from now on.",
2024-11-21,Neuralink brain chips head for the Great White North,"Neuralink brain chips head for the Great White North
Canadian volunteers wanted for mind-meld trials
Elon Musk's brain chip biz, Neuralink, has been given the nod by Health Canada to start recruiting for its CAN-PRIME Study.
The study is a trial for the neuro…",
2024-11-21,What Trump's presidency means for the future of AI,"Elon Musk has become an influential member of President-elect Donald Trump's orbit.
AP Photo/Julia Nikhinson
Donald Trump has surrounded himself with people who have competing views on AI regulation.
Elon Musk, for example, has supported more AI regulation in…",
2024-11-21,Neuralink brain chips head for the Great White North,"Canadian volunteers wanted for mind-meld trials
Elon Musk's brain chip biz, Neuralink, has been given the nod by Health Canada to start recruiting for its CAN-PRIME Study.…",
2024-11-21,"Elon Musk’s, and Gene Wilder’s, former LA home has a $3M-plus price cut as it faces a foreclosure sale",A Bel Air home that Elon Musk sold to Gene Wilder's nephew is facing a foreclosure sale -- if it doesn't find a new owner beforehand thanks to a new discount.,
2024-11-21,[Removed],[Removed],
2024-11-21,Several of Trump's cabinet picks — and Trump himself — have been accused of sexual misconduct,"While Matt Gaetz has withdrawn from the nomination process for attorney general, President-elect Donald Trump has picked several other people for his Cabinet and key staff positions who have been accused of some form of sexual misconduct. Trump himself has lo…",
2024-11-21,What Trump's presidency means for the future of AI,"Elon Musk has been an advocate for tighter regulations on AI. JD Vance, not so much.",
2024-11-21,"Putin Is Doing the Opposite of What Trump Advised, Republican Says",Russian President Vladimir Putin launched missiles on Ukraine.,
2024-11-21,Tabletop creators leave X for Bluesky in droves,"In the wake of the US Election, tabletop creators and fans are leaving the Elon Musk-owned X for alternatives like Bluesky. While alternatives like Thread and Mastodon have also seen growth during this social media exodus, Bluesky’s unique combination of cont…",
2024-11-21,"Trump’s Got Very Important Jobs For Vivek, Elon, And Marge",And they're definitely not busywork to keep them out of his weave!,
2024-11-21,"Just How Big Is the Federal Government, Anyway?",Trump's plans to reshape the federal bureaucracy will have implications for millions of employees across the country.,
2024-11-21,Automakers plead with Trump: don’t kill the EV tax credit,"The auto industry is urging Donald Trump to spare the $7,500 EV tax credit and pass a regulatory framework for autonomous vehicles.",
2024-11-21,Elon Musk's Father Is Worried About Him,"Errol Message Elon Musk's estranged father, Errol Musk, is concerned that his son is too busy.  ""Elon has no eyes on anything more than trying to make sure that whatever he does now, …he's able to give a proper job without affecting his own work,"" he said in …",
2024-11-21,Western censorship of Russia worse than of USSR – journalist,"Countries that once printed Brezhnev’s speeches have now criminalized RT, Glenn Greenwald told Tucker Carlson Read Full Article at RT.com",
2024-11-21,"Musk, Ramaswamy Proposal to Slash Spending Could Include VA Medical Services","A plan by the incoming Trump administration to slash government funding could kneecap Department of Veterans Affairs health care. In an op-ed for the Wall Street Journal this week , Elon Musk and Vivek Ramaswamy, who President-elect Donald Trump tapped to lea…",
2024-11-21,Mehmet Oz loves promoting this inferior Medicare substitute,History suggests Dr. Mehmet Oz will seek to boost the use of Medicare Advantage — and that he’ll do it with the support of Trump.,
2024-11-21,Company Has Too Many Dans,"JACKSON, MS — In a recent company audit, Grayson Manufacturing learned the company has a concerning surplus of employees named Dan.",
2024-11-21,Ransomhub ransomware gang claims the hack of Mexican government Legal Affairs Office,"Mexico is investigating a ransomware attack targeting its legal affairs office, as confirmed by the president amidst growing cybersecurity concerns. Mexico’s president announced the government is investigating an alleged ransomware hack that targeted the admi…",
2024-11-21,"I'm Seeing a Strong Shift to Bluesky by SLers --- Including Cajsa, Who Just Closed Her Huge Twitter/X Account","New World Notes columnist Cajsa Lilliehook just locked up her fairly large X/Twitter account (with nearly 20,000 followers) and opened up shop in Bluesky here. I wasn't surprised when she told me this last night (for reasons I'll explain below),...",
2024-11-21,About 1 in 3 of Trump’s cabinet picks have been accused of sexual misconduct,"With six members of the 15-plus member leadership team facing allegations, approximately one-third of the top White House staff have a history of misconduct claims.",
2024-11-21,This Broken Tesla Cybertruck Went Viral. Now It’s Heading to Auction.,A mangled 2024 Tesla Cybertruck that went viral online after it was photographed parked on the streets of Seattle will be auctioned off on Copart.,
2024-11-21,Maddow takes $5 million pay cut... | | MSNBC's future in jeopardy...,"MSNBC anchor Rachel Maddow will reportedly take a $5 million pay cut as the cable television network’s ratings continue to dwindle. The news came as Comcast, NBC’s parent company, annou…",
2024-11-21,Elon Musk Admits He Was Wrong After Jeff Bezos Shows Up On X To Knock Down False Election Claim,Elon Musk has corrected himself after falsely accusing fellow billionaire Jeff Bezos of pre-election day conduct that Bezos himself took to X (formerly Twitter) to deny.,
2024-11-21,[Removed],[Removed],
2024-11-21,Fox News Politics: Opening the flood Gaetz,"The Fox News Politics newsletter, with the latest updates on the Trump transition, exclusive interviews and more Fox News politics content.",
2024-11-21,OnlyFans Model Elsa Thora Pleads to Have Mars Baby With Elon Musk,An OnlyFans model in Germany wants to make history with Elon Musk ... by giving birth to the first baby on Mars. Elsa Thora tells TMZ ... she wants to get knocked up by Elon and pop out their child on the Red Planet. The social media influencer and…,
2024-11-21,[Removed],[Removed],
2024-11-21,Jennifer Rubin Should Chill,"Jennifer Rubin is a columnist for The Washington Post and commentator for MSNBC. Once upon a time she was considered a conservative writer—indeed, her",
2024-11-21,"DOGE wants to trim a $500 billion list of 'zombie' programs that includes veterans' healthcare, Pell grants, and NASA","Getty Images; Chelsea Jia Feng/BI
Elon Musk and Vivek Ramaswamy wrote an op-ed in The Wall Street Journal detailing their vision for cutting government costs.
One major target is a list of programs with expired congressional funding authorization, totaling $5…",
2024-11-21,"Ex-ESPN employee Jemele Hill defends Lebron James' social media break, says X is 'at an all-time low'","Former ESPN talent Jemele Hill defended LeBron James for taking a social media break while ripping X for being at an ""all-time low"" in her opinion.",
2024-11-21,What Are Bluesky Starter Packs? How to Find And Create Them,Building your Bluesky feed from scratch is hard. Starter packs can help.,
2024-11-21,"DOGE wants to trim a $500 billion list of 'zombie' programs that includes veterans' healthcare, Pell grants, and NASA","Elon Musk and Vivek Ramaswamy said they're looking at a list of programs with expired funding authorization, including NASA and childcare grants.",
2024-11-21,[Removed],[Removed],
2024-11-21,[Removed],[Removed],
2024-11-21,"Neuralink human trial now approved in Canada, clinical trials to start",Health Canada has approved the first human trial for Neuralink’s clinical studies in the country. This marks the first time a clinical trial from the company will take place outside of the U.S. The launch of the first Canadian-based human trial from Neuralink…,
2024-11-21,Move to defund Planned Parenthood under Trump administration signaled,"Elon Musk, the CEO of SpaceX and Tesla, along with former Presidential candidate and businessman Vivek Ramaswamy, were recently tapped by President-Elect Donald Trump to head the Department of Government Efficiency, or DOGE, a new Government agency tasked wit…",
2024-11-21,Incoming FCC chair says unlikely commission could reinstate Starlink subsidy,Incoming FCC chair says unlikely commission could reinstate Starlink subsidy,
2024-11-21,FACT CHECK: Can Ron DeSantis Choose Who Fills Matt Gaetz’s Vacant Seat?,A post shared on social media purports that Florida Governor Ron DeSantis can fill the House of Representatives vacancy of Florida Republican Rep. Matt Gaetz. Verdict: False The seat must be filled by a special election process. Fact Check: The House Ethics C…,
2024-11-21,[Removed],[Removed],
2024-11-21,"'The View' co-host Whoopi Goldberg says Elon Musk is Trump's 'actual vice president,' should give up X","""The View"" co-host Whoopi Goldberg floated the idea Thursday that X owner Elon Musk, not JD Vance, is President-elect Trump's ""real vice president.""",
2024-11-21,DOGE Leaders Elon Musk and Vivek Ramaswamy Say Mandating In-Person Work Would Make 'a Wave' of Federal Employees Quit,"DOGE Leaders Elon Musk and Vivek Ramaswamy Say Mandating In-Person Work Would Make 'a Wave' of Federal Employees Quit The two published an op-ed outlining their goals for their new department, including workforce reductions.
Key Takeaways
Elon Musk and Vivek …",
2024-11-21,"Top US securities regulator to exit, clearing way for Trump pick","The top US securities regulator, a skeptic towards cryptocurrency who was appointed by President Joe Biden, announced Thursday he will step down in January when Donald Trump takes office. Gary Gensler, chair of the Securities and Exchange Commission (SEC), sa…",
2024-11-21,Jaguar Releases 3-Hour Commercial That's Just A Naked Guy Doing A One-Man Performance Of 'Hamilton',COVENTRY — Luxury vehicle manufacturer Jaguar Cars stunned the automobile industry by releasing a daring three-hour commercial featuring no car and just a naked man putting on a one-man show of the hit Broadway production Hamilton.,
2024-11-21,U.S. automakers plan to acquire Trump's nod to sell EVs: NYT,"NEW YORK, Nov. 21 (Xinhua) -- Three of the U.S. largest automakers, Ford, General Motors and Stellantis, are strategizing with other car manufacturers on how to make a delicate request of President-elect Donald J. Trump: don't scrap the federal regulations th…",
2024-11-21,"Top US Securities Regulator To Exit, Clearing Way For Trump Pick","The top US securities regulator, a skeptic towards cryptocurrency who was appointed by President Joe Biden, announced Thursday he will step down in January when Donald Trump takes office.",
2024-11-21,"Airborne 11.20.24: Starship 6!, Boom XB-1 Flies Again, Spirit Bankrupt","Also: Apache Rendezvous, Qantas A380 Tool FoulUp, SWA Shooting, USCG Rescue With President-Elect Donald Trump in attendance to see his new buddy Elon Musk, do his thing; Starship 6 launched on time Tuesday afternoon with a spectacular, but not 100% successful…",
2024-11-21,[Removed],[Removed],
2024-11-21,Matt Gaetz Mocked With Scaramucci Comparisons After AG Withdrawal,Anthony Scaramucci in 2017 set a record as the shortest-serving communications director in White House history.,
2024-11-21,'Would love to': Republicans jostle for open spots on Marjorie Taylor Greene-led DOGE panel,Several House Republicans are showing interest in being part of the House Oversight Committee's DOGE subcommittee.,
2024-11-21,"ICC issues arrest warrants for Netanyahu, Gallant and Hamas official","Benjamin Netanyahu, Yoav Gallant and Mohammed Deif are wanted by the ICC in relation to alleged war crimes, and changes to the Migration Act could see tens of thousands deported.
The post ICC issues arrest warrants for Netanyahu, Gallant and Hamas official ap…",
2024-11-21,Australia launches 'landmark' bill to ban social media for children under 16,Proposes fines of up to $49.5 million for platforms.,
2024-11-21,Follow The Phoblographer on BlueSky and Threads,"The Phobolographer was founded over 15 years ago, and since then, we have consistently reinvented ourselves and ensured we remain inclusive. As a journalistic website, we report the news accurately, our reviews are honest and offer transparency in our practic…",
2024-11-21,Loyalist US congressman Gaetz withdraws as Trump attorney general pick,"WASHINGTON: Right-wing firebrand Matt Gaetz on Thursday (Nov 19) pulled out of the confirmation process to become US attorney general, pitching Donald Trump's incoming administration into fresh turmoil.",
2024-11-21,Trump attorney general pick Matt Gaetz drops bid in face of Senate opposition,WASHINGTON: Hardline Republican Matt Gaetz withdrew his name from consideration as President-elect Donald Trump's attorney general after the former lawmaker faced opposition from Senate Republican,
2024-11-21,Why the Media Loves the Worst of Crypto,"The fixation on the least reputable aspects of the industry obscures the real progress being made in areas like DePIN, stablecoins and DeFi, says Mahesh Ramakrishnan.",
2024-11-21,"For DOGE to Hunt Waste, It Needs Ron Paul to Sic Itt","Writes Pluto9999: Lew As we saw in the first iteration of Trump, we again see the great Republican/Conservative/Faux Libertarian pipe dream of slashing government spending, and of putting America onto a strict Constitutional pathway, this time through the new…",
2024-11-21,[Removed],[Removed],
2024-11-21,You Too Can Hire an ‘Etsy Witch’ to Curse Elon Musk,Riley Wenckus used TikTok to tell Elon Musk she paid “an Etsy witch” $7.99 to make his life “a living hell.” A new market has opened up for others looking to follow her lead.,
2024-11-21,Starlink Snub: Brazil Signs Deal With Musk's Chinese Competitor To Provide Internet Service,China's SpaceSail will work with Brazil's Telebras to bring broadband to remote areas of the South American country.,
2024-11-21,Australia launches 'landmark' bill to ban social media for children under 16,Proposes fines of up to $49.5 million for platforms.,
2024-11-21,Take A Glimpse Into The Deranged New Playground For Online Liberals,"If you thought online liberals were weird before the election of Donald Trump, I have some news for you.",
2024-11-21,Australia launches 'landmark' bill to ban social media for children under 16,Proposes fines of up to $49.5 million for platforms.,
2024-11-21,Sam Altman says there was a 'simple' reason OpenAI ditched the nonprofit approach,"While OpenAI's move from a nonprofit to a capped-profit structure caused some stir, CEO Sam Altman says it boiled down to one main reason.",
2024-11-21,The Latest: Matt Gaetz withdraws his name from consideration as Trump’s attorney general,Former Florida congressman Matt Gaetz has withdrawn as President-elect Donald Trump’s pick for attorney general following scrutiny over a federal sex trafficking investigation,
2024-11-21,Australia launches 'landmark' bill to ban social media for children under 16,Proposes fines of up to $49.5 million for platforms.,
2024-11-21,Gary Gensler to leave role as SEC chairman,"Donald Trump revealed plans to sack Mr Gensler on ""day one"" of his new administration.",
2024-11-21,Trump Goes Full Dictator in Latest Threat to GOP Senators,"Matt Gaetz may be out of the running for attorney general, but Donald Trump still has plenty of horrific nominees he’s trying to push through Senate confirmation—and he’s threatening to unseat any Republican that gets in his way. 
Trump, JD Vance, and their …",
2024-11-21,[Removed],[Removed],
2024-11-21,America’s new 1%: Free-spending DINKs shelling out for a luxury lifestyle of vacations and take-out,"On average, DINKs spend four times more on dining each month than other Americans ($816 vs. $215) and allocate nearly double the typical budget for vacations, investing around $2,000 per trip.",
2024-11-21,[Removed],[Removed],
2024-11-21,Several of Trump's Cabinet picks — and Trump himself — have been accused of sexual misconduct,Former congressman Matt Gaetz has withdrawn his name as President-elect Donald Trump's choice for attorney general in the face of sexual misconduct allegations,
2024-11-21,Several of Trump's Cabinet picks — and Trump himself — have been accused of sexual misconduct,Former congressman Matt Gaetz has withdrawn his name as President-elect Donald Trump's choice for attorney general in the face of sexual misconduct allegations,
2024-11-21,SpaceX Starlink mission set to launch from Brevard County Thursday morning - WESH 2 Orlando,"SpaceX Starlink mission set to launch from Brevard County Thursday morningWESH 2 Orlando SpaceX launch recap: Live Starlink mission updates Thursday from CapeFlorida Today SpaceX launches 24 Starlink satellites from Florida, its 7th liftoff in a week (video)S…",
2024-11-21,Several of Trump’s Cabinet picks — and Trump himself — have been accused of sexual misconduct,"Taken together, there are a striking number of incidents.",
2024-11-21,Sexual Misconduct Allegations Against Trump’s Government Picks: A Running List,"Several of Donald Trump's top picks to lead his government have been accused of sexual assault, harassment or child sex trafficking.",
2024-11-21,"SpaceX’s Starship Sonic Booms Are So Intense, They Could Damage Nearby Structures",A test flight of the megarocket unleashed a massive sonic boom—at least 10 times louder than the roar of a Falcon 9 rocket—as SpaceX sets its sights on launching it up to 100 times a year.,
2024-11-21,Former Trump Official Calls out Cabinet Picks' 'Salacious Baggage',"The hosts of The View criticized Trump's Cabinet picks, questioning ties to sexual misconduct. Matt Gaetz withdrew from Attorney General consideration.",
2024-11-21,US SEC Chief Gary Gensler To Step Down Clearing Way For Trump's Pick,"The top US securities regulator, a skeptic towards cryptocurrency who was appointed by President Joe Biden, announced Thursday he will step down in January when Donald Trump takes office.",
2024-11-21,[Removed],[Removed],
2024-11-21,Donald Trump Settles Music Lawsuit,"Donald Trump settled a lawsuit over his use of Eddy Grant's ""Electric Avenue"" video during his 2020 campaign.",
2024-11-21,[Removed],[Removed],
2024-11-21,Crypto entrepreneur Justin Sun buys $6 million banana—and plans to eat it unless Elon Musk wants to send it to space,"Sun outbid six others for the iconic work. 
 Read More",
2024-11-21,The View's Whoopi Goldberg Reveals Who She Really Believes Is Vice President-Elect Right Now,"The View co-host Whoopi Goldberg shared some thoughts about who she believes is actually acting as Vice President-elect right now. While Donald Trump ran with JD Vance as his running mate, Whoopi believes Elon Musk is currently acting as his actual running ma…",
2024-11-21,Biden's Antitrust Policy Was Politicized and Irresponsible. Will Trump Be Better?,"Federal Trade Commission Chair Lina Khan used the state to achieve political aims that have nothing to do with keeping markets competitive. J.D. Vance has said she's done ""a good job.""",
2024-11-21,The Miss Universe CEO said crowning a winner with 'blonde hair and blue eyes' is the 'ultimate evolution' for the pageant,"Miss Universe leaders Anne Jakrajutatip and Raul Rocha also shared comments by Elon Musk praising the pageant for picking a ""biological female.""",
2024-11-21,Male Passenger Disappointed After Another Flight Ends Without A Stewardess Frantically Asking If Anyone Can Land The Plane,"LOS ANGELES, CA — At the end of a transcontinental trip, a male passenger was reportedly disappointed that yet another flight he was aboard landed safely without a stewardess frantically asking if anyone could try to land the plane.",
2024-11-21,Crypto entrepreneur Justin Sun buys $6 million banana—and plans to eat it unless Elon Musk wants to send it to space,Sun outbid six others for the iconic work.,
2024-11-21,[Removed],[Removed],
2024-11-21,Paige Spiranac slams internet trolls in Sabrina Carpenter sex appeal row,Paige Spiranac has hit out at trolls who criticize her for her sex appeal and defended Sabrina Carpenter as the 25-year-old singer continues to use innuendos and implications in he,
2024-11-21,Elon Musk and Vivek Ramaswamy Promise New Podcast to Discuss Destruction of U.S. Government,Elon Musk and Vivek Ramaswamy have suggested they'll cut $2 trillion in government spending with DOGE.,
2024-11-21,DOGE Can Succeed by Scaling Back Its Ambitions,"The new advisory group promises bold savings and massive spending cuts, but without any expertise in the federal budget, it’s likely to be all bark and no bite.",
2024-11-21,SAM ADOLPHSEN: Every State Needs A DOGE,'Conservatives in the states can seize the moment',
2024-11-21,2:00PM Water Cooler 11/21/2024,"~ Today's Water Cooler: Politics, syndemics; Gaetz: Exit, stage right; Ortberg: ""The beatings will continue until morale improves""; How the Democrats abandoned the working class ~",
2024-11-21,Top Trump advisor makes direct threat to Republicans wavering on Cabinet picks: report,"A senior Donald Trump official has issued a threat to Senate Republicans: support and confirm the Cabinet and administration nominees the president-elect is choosing or face a primary challenge funded by the world’s richest person, according to a new report f…",
2024-11-21,"Trump’s Cabinet And Key Jobs: Gaetz Out As AG—As Hegseth, RFK Jr. Face Controversies","Matt Gaetz has withdrawn from consideration as attorney general, as Trump plans to make RFK Jr. his secretary of health and human services and Pete Hegseth his defense secretary, and place Tulsi Gabbard, Kristi Noem and Stephen Miller in key posts.",
2024-11-21,Loyalist Gaetz withdraws as Trump attorney general pick,"Right-wing firebrand Matt Gaetz on Thursday pulled out of the confirmation process to become US attorney general, pitching Donald Trump's incoming...",
2024-11-21,Gaetz withdraws as Trump’s attorney general pick,"Scandal-plagued Matt Gaetz, who was nominated by President-elect Donald Trump to be US Attorney General, on Thursday, pulled out of the confirmation process in an early setback for the incoming administration. Gaetz was one of Trump’s several eye-catching sel…",
2024-11-21,Trump Pick Matt Gaetz Withdraws As Nominee For US Attorney General,"Scandal-plagued Matt Gaetz, who was nominated by President-elect Donald Trump to be US attorney general, on Thursday pulled out of the confirmation process in an early setback for the incoming administration.",
2024-11-21,[Removed],[Removed],
2024-11-21,[Removed],[Removed],
2024-11-21,[Removed],[Removed],
