title,description,url,coding
The DOJ vs. Google: Breaking down the latest in the antitrust case and what it means for Chrome's future,The DOJ recommending Google sell its popular browser Chrome comes with a number of knock-on effects.,https://www.businessinsider.com/justice-department-wants-google-to-sell-chrome-antritrust-case-impact-2024-11,
Elon Musk isn't finished,"While some House races remain uncalled as the counting of votes continues, the 2024 election season is effectively over, with President-elect Donald Trump headed to the White House. But one of his biggest supporters isn’t ready to stop.Read more...",https://qz.com/elon-musk-politics-election-donald-trump-america-pac-1851695635,
"Drivers are being 'ill-served by underwhelming EVs,' says boss of Tesla rival Lucid","Lucid CEO Peter Rawlinson told the Cars and Culture podcast that the problem with EVs in the US was ""not perception, but reality.""",https://www.businessinsider.com/lucid-ceo-tesla-rival-on-american-evs-chinese-rivals-2024-11,
"Trump, Musk and new cabinet nominees celebrate at UFC","The President-elect was joined by Robert F Kennedy Jr, Tulsi Gabbard and Vivek Ramaswamy.",https://www.bbc.com/news/articles/ckgd1p8w4xlo,
CNBC anchors and insiders worry about their futures as Comcast looks to unload the network,"Comcast announced it would spin off most of its cable networks, including CNBC, into a separate entity.",https://www.businessinsider.com/cnbc-staff-questions-worry-about-future-comcast-spinoff-2024-11,
Elon Musk Fires Back at ‘SNL’s Chloe Fineman,‘My ‘SNL’ appearance is going to be so f***ing unfunny that it will make a crackhead sober!!’,https://www.cracked.com/article_44354_elon-musk-fires-back-at-snls-chloe-fineman.html,
Rocket plane blasts through sound barrier on route to hypersonic flight,"Dawn Aerospace has flown its rocket-powered aircraft past the speed of sound, the latest milestone on its path to its first commercial flights. During the test, which took place on New Zealand’s South Island, the startup’s Mk-II Aurora aircraft reached Mach 1…",https://thenextweb.com/news/dawn-aerospaces-spaceplane-rocket-aircraft-breaks-sound-barrier,
"ExTwitter’s New Lawsuit Accurately Argues California Deepfake Law Violates First Amendment, Section 230","Elon Musk’s ExTwitter has filed an important First Amendment lawsuit against California over its unconstitutional law regulating deepfakes. This follows Musk’s earlier successful challenge to the state’s social media “transparency” law. Yes, sometimes Elon Mu…",https://www.techdirt.com/2024/11/19/extwitters-new-lawsuit-accurately-argues-california-deepfake-law-violates-first-amendment-section-230/,
Trump names former Rep. Tulsi Gabbard for director of national intelligence,"The former Democratic congresswoman has shifted her political allegiance in recent years, going from a candidate for the Democratic presidential nomination in 2020 to a stalwart Trump supporter.",https://www.npr.org/2024/11/13/nx-s1-5189603/trump-tulsi-gabbard-director-of-national-intelligence,
Bluesky reaches 15 million users as more people look for alternatives to X,"Bluesky, one of the many microblogging platforms, has now officially reached the milestone of 15 million registered users. A month ago, Bluesky still had 13 million followers, which shows that the social network is growing rapidly as more people look for alte…",https://9to5mac.com/2024/11/13/bluesky-15-million-users/,
"Trump taps Sean Duffy, Fox host and former Congressman, for Transportation Secretary","President-elect Trump has picked Sean Duffy, a Fox Business host and former Republican Congressman from Wisconsin, to head the Department of Transportation.",https://www.npr.org/2024/11/18/nx-s1-5188388/dot-transportation-secretary-sean-duffy-trump,
Dell pays $2.3 million to settle claims that it overcharged the US Army for computers,"Dell and one of its resellers created the ""false appearance of competition,"" the Department of Justice said.",https://www.businessinsider.com/dell-justice-department-overcharging-settlement-us-government-contracts-2024-11,
Sam Altman says there was a 'simple' reason OpenAI ditched the nonprofit approach,"While OpenAI's move from a nonprofit to a capped-profit structure caused some stir, CEO Sam Altman says it boiled down to one main reason.",https://www.businessinsider.com/sam-altman-why-openai-changed-nonprofit-model-2024-11,
These Trump loyalists named to roles in the new administration once flocked to a courtroom for his criminal trial,Four loyalists who rallied behind President-elect Donald Trump during his criminal hush-money trial have been tapped for roles in his administration.,https://www.businessinsider.com/donald-trump-loyalists-picked-new-administration-hush-money-trial-2024-11,
Rubio and Waltz picks put China back at the center of US foreign policy,"Trump’s expected choice of Sen. Marco Rubio and Rep. Mike Waltz indicates China is going to be at the center of U.S. foreign policy, deepening U.S.-China tensions.",https://abcnews.go.com/Politics/rubio-waltz-picks-puts-china-back-center-us/story?id=115787057,
