date,title,description,coding
2024-11-21,Want to try AI? This new tool is the best place to start,"Merlin AI makes advanced AI accessible to beginners, offering easy tools to streamline work and boost productivity.",
2024-11-21,Ark’s Cathie Wood lets retail investors bet on Elon Musk’s private startups and potentially profit from his proximity to Trump,"Cathie Wood’s ARK Invest is inviting retail investors to bet on Tesla CEO Elon Musk’s private startups and possibly profit from his newfound closeness to President-elect Donald Trump in the process.
Through its ARK Venture Fund, the firm is giving retail inve…",
2024-11-21,So You’re Thinking of Leaving X for Bluesky. How Does It Work?,"Bluesky, the Twitter-like social media platform that emerged as an alternative for X users who had become frustrated with Elon Musk’s ownership of the platform, is having a second wind.
When Mr. Musk bought X — then called Twitter — in October 2022, competito…",
2024-11-21,X’s former head of global affairs takes job with Musk rival Sam Altman,"Nick Pickles will be the chief policy officer for Sam Altman’s Tools for Humanity.

Nick Pickles, the former head of global affairs at Elon Musk’s social media platform X, is joining forces with one of Musk’s rivals, his fellow OpenAI cofounder Sam Altman.",
2024-11-21,[Removed],[Removed],
2024-11-21,[Removed],[Removed],
2024-11-21,[Removed],[Removed],
2024-11-21,The Awful Truth Trump’s Cabinet Picks Make Clear,This is a feminist backlash.,
2024-11-21,"Good Morning, News: Feds to Pay Portland Protester, Weird Stink Mystery Solved, and Trump's Cabinet of Sexual Abusers","by Wm. Steven Humphrey
 
 
 
 If you’re reading this, you probably know the value of the Mercury’s news reporting, arts and culture coverage, event calendar, and the bevy of events we host throughout the year. The work we do helps our city shine, but we can’t…",
2024-11-21,[Removed],[Removed],
2024-11-21,“100% Not True”: Jeff Bezos Responds To Elon Musk’s Gossipy Claim That He Predicted Trump Loss And Urged Sale Of Tesla And SpaceX Stock,"Jeff Bezos pushed back on Elon Musk’s claim that the Amazon founder predicted a Trump loss in the 2024 election and that shareholders should sell their Tesla and SpaceX stock. Musk, CEO of those companies, posted early this morning that he “just learned tonig…",
2024-11-21,Here’s Larry Summers’ advice to Trump on the economy and Elon Musk,"Former U.S. Treasury Secretary Larry Summers is a longtime Democrat who served as an advisor to Presidents Bill Clinton and Barack Obama, but he remains cautiously optimistic that President-elect Donald Trump, and his advisor Elon Musk, could make some positi…",
2024-11-21,Musk and Ramaswamy call for ending work-from-home for federal employees,"Pair suggest Trump could require government workers to be in-office five days a week as part of effort to trim workforce
Elon Musk and Vivek Ramaswamy suggested Donald Trump could require government employees to be in the office five days a week as part of an…",
2024-11-21,Former X policy chief joins Sam Altman’s Tools for Humanity,"X’s former top policy chief has taken a job at Tools for Humanity, the company building the tech to support World Network (formerly Worldcoin).
Nick Pickles, previously head of global affairs at X, Elon Musk’s social media platform, will serve as chief policy…",
2024-11-21,Former X policy chief joins Sam Altman's Tools for Humanity | TechCrunch,"X's former top policy chief, Nick Pickles, has taken a job at Sam Altman's Tools for Humanity cryptocurrency startup.",
2024-11-21,"The D Brief: DOD’s Replicator program advances; Nuclear forensics in Idaho; Austin, Milley defend women in combat; Intel watchdogs resign; And a bit more.",,
2024-11-21,"What’s up with… NTT Docomo, the FCC, Harmonic","NTT Docomo, Nokia, SKT put AI to work in 6G testsThe head of the FCC is clearing her deskActivist investor wants Harmonic to throw itself at Ciena",
2024-11-21,Trump Takes His Time With Secret Service Director Choice,"It just might be the most personal hiring decision President-elect Trump will ever make, but if he’s already chosen, he’s keeping the contenders in suspense. After surviving two assassination attempts in roughly two months, Donald Trump is in the awkward posi…",
2024-11-21,People Who Automated Their Jobs and Accidentally Created Digital Monsters,"<p>When developer James Liu created a script to automate his daily standup meetings, he didn't expect his bot to get employee of the month. When marketer Sarah Chen automated her social media, she didn't plan for her bot to start a Twitter war with Elon Musk.…",
2024-11-21,[Removed],[Removed],
2024-11-21,[Removed],[Removed],
2024-11-21,X's former policy chief takes job with Elon Musk rival Sam Altman,"NEW YORK — Nick Pickles, the former head of global affairs at Elon Musk's social media platform X, is joining forces with one of Musk's rivals, his fellow OpenAI co-founder Sam Altman.


Pickles, who resigned from X in September, told Reuters on Wednesday tha…",
2024-11-21,Italy moves to replace courts that ruled against its migrant detentions,Italy moves to replace courts that ruled against its migrant detentions,
2024-11-21,Italy moves to replace courts that ruled against its migrant detentions,"ROME (Reuters) - Italy's right-wing coalition has passed rules to change the courts responsible for validating the detention of migrants, in what the opposition said was a vendetta against judges who recently blocked a plan to send asylum seekers to Albania. …",
2024-11-21,FATCAT FIGHT: Jeff Bezos Fires Back at Elon Musk Over Inflammatory Claim He Trash Talked Donald Trump,"Elon Musk, the billionaire entrepreneur and close advisor to Donald Trump, made an incendiary claim about Amazon founder Jeff Bezos that Bezos rejected.
The post FATCAT FIGHT: Jeff Bezos Fires Back at Elon Musk Over Inflammatory Claim He Trash Talked Donald T…",
2024-11-21,Brazil Makes Deal With Starlink Competitor Following Elon Musk X Dispute,"Brazil has forged a partnership with China's SpaceSail to expand satellite internet services, potentially disrupting Elon Musk's Starlink dominance in the region.
SpaceSail and Brazil's state telecommunications firm Telebras signed a memorandum of understandi…",
2024-11-21,"Elon Musk unveils plan to impose mandatory RTO for government workers, counting on a wave of resignations which he calculates will save billions","Together with DOGE partner Vivek Ramaswamy, they are targeting ‘mass headcount reductions across the federal bureacracy’ Read More",
2024-11-21,"Musk, Ramaswamy Reveal DOGE Blueprint To Cut Government Waste","Musk, Ramaswamy Reveal DOGE Blueprint To Cut Government Waste
 
Elon Musk and Vivek Ramaswamy have laid out their vision for the newly formed Department of Government Efficiency (DOGE).
According to a new WSJ op-ed, the pair writes that ""Our nation was founde…",
2024-11-21,‘Pretty accurate’: Elon Musk’s response to Q drop reignites conspiratorial fever,"Billionaire Elon Musk has conspiracy theorists celebrating once again after responding on Wednesday to a ""Q drop.""


The incident unfolded after a follower of the QAnon conspiracy theory, which revolves around the belief that President-elect Donald Trump has …",
2024-11-21,Bezos denies Musk's claim he told people to sell Tesla and SpaceX stock since Trump would lose,Jeff Bezos has officially thrown cold water on Elon Musk’s latest claim about his billionaire rival. Read more...,
2024-11-21,[Removed],[Removed],
2024-11-21,It’s the final countdown: One NZ gears up for Starlink's Direct to Cell - what to expect,Direct to Cell communication would be a 'game-changer'.,
2024-11-21,Sarah Palin Is Mad She Didn't Get a Cabinet Nom (Womp Womp),"Back in the ancient times (October), I noted a clearly prescient theory bouncing around that Elon Musk was trying to install himself as some sort of shadow president by glomming onto Trump. ""Dear God, please let Elon actually believe this,""...
Read more...",
2024-11-21,Is Bluesky really the new Twitter? The Late Late Toy Show will tell,"Donald Trump’s election, and Elon Musk’s part in it, has produced one new tech winner: Bluesky. Tens of thousands of Irish people are among the one million a day who are flocking to join the first genuine Twitter replacement service in a decade.",
2024-11-21,"FACT CHECK: No, Turkey Is Not Leaving NATO",A post shared on Facebook claims that Turkey is leaving the North Atlantic Treaty Organization (NATO). Verdict: False There is no evidence for this claim. Fact Check: Turkish airstrikes have cut off access to water and electricity to over a million people in …,
2024-11-21,Brazil Makes Deal With Starlink Competitor Following Elon Musk X Dispute,"Around 46 percent of Brazil's internet reportedly comes through Starlink, so the agreement could be a move to reduce reliance on Musk's company.",
2024-11-21,"Elon Musk unveils plan to impose mandatory RTO for government workers, counting on a wave of resignations which he calculates will save billions","Together with DOGE partner Vivek Ramaswamy, they are targeting ‘mass headcount reductions across the federal bureacracy’",
2024-11-21,"Good luck, Department of Government Efficiency","COMMENTARY | It sounds like a federal agency, but its job is to get rid of them.",
2024-11-21,Elon Musk and Grimes have ended their custody dispute in Texas,"Elon Musk and the musician Grimes attending the Met Gala in 2018.
Variety/Penske Media via Getty Images
The Travis County clerk's office told BI Elon Musk and Grimes have ended their custody dispute.
Musk sued Grimes in the Texas court last year, and Grimes c…",
2024-11-21,"Trump could make Biden’s EV mandates obsolete, revamp industry with 1 move","President-elect Donald Trump’s return to the White House could mean an overhaul of current electric vehicle (EV) regulations and other sweeping changes for the U.S. automotive industry, experts who spoke with the Daily Caller News Foundation claimed.",
2024-11-21,What Mark Cuban's Pivot From X to Bluesky Says About the Platform's Future,"Since the election, hordes of high-profile X users are migrating to Bluesky. Mark Cuban, who has a longstanding rivalry with Elon Musk, is among them.",
2024-11-21,Marjorie Taylor Greene to chair subcommittee working with Elon Musk's agency,"Rep. Marjorie Taylor Greene (R-GA) has been named as the chair of a subcommittee expected to work with President-elect Donald Trump's new Department of Government Efficiency (DOGE), which Elon Musk and Vivek Ramaswamy are leading.House Oversight Committee Cha…",
2024-11-21,Scientists say that there is one big problem with Elon Musk-owned SpaceX's massive starship; what is it and how damaging is it?,Scientists warn that the sonic booms from SpaceX's Starship rocket are powerful enough to damage buildings and property.,
2024-11-21,What to know about Musk and Ramaswamy's op-ed with details on their efficiency department,"Elon Musk and Vivek Ramaswamy shed some light on their plans for the ""Department of Government Efficiency"" in an op-ed for the Wall Street Journal. CBS News senior White House and political correspondent Ed O'Keefe has more on that and Pete Hegseth's visit to…",
2024-11-21,[Removed],[Removed],
2024-11-21,AI could turn against humanity – award-winning scientist,"The unrestricted rise of artificial Intelligence could threaten geopolitical stability, Yoshua Bengio has warned Read Full Article at RT.com",
2024-11-21,"Musk, Ramaswamy Detail DOGE Plan to Drain the Swamp","Elon Musk and Vivek Ramaswamy released a plan of action on Wednesday to cripple the administrative state, increase efficiency, and save taxpayer money.
The post Musk, Ramaswamy Detail DOGE Plan to Drain the Swamp appeared first on Breitbart.",
2024-11-21,[Removed],[Removed],
2024-11-21,Elon Musk’s $2 Trillion Fiscal Fantasy,"It is often said that a businessman like Donald Trump or Elon Musk will know how to put America’s fiscal house in order. But between Trump’s planned tax cuts and Musk’s absurd estimate of how much federal spending can be reduced, the smart money says they hav…",
2024-11-21,La fantasía fiscal de dos billones de dólares de Elon Musk,Project Syndicate - The World’s Opinion Page,
2024-11-21,Elon Musk and Grimes have ended their custody dispute in Texas,"The Clerk's office in Travis County, Texas, confirmed that the the custody lawsuit between Musk and Grimes is ""closed.""",
2024-11-21,Most Tesla Semi Customers Have Waited Seven Years Already. Will They Really Have To Wait A Full Decade?,"When it was announced in 2017, the Tesla Semi was supposed to be a game-changer. With promises of a greener future for the trucking industry and orders from ...",
2024-11-21,Even Elon Musk Cannot Make Government Bureaucracy “Efficient”,"As explained by Ludwig von Mises in his book, Bureaucracy.  Michael Munger, political science professor at Duke and past president of the Public Choice Society explains.
The post Even Elon Musk Cannot Make Government Bureaucracy “Efficient” appeared first on …",
2024-11-21,Bezos Denies Claim He Said To Sell Tesla Stock And Trump Would Lose—Latest In Musk Feud,"“Nope. 100% not true,"" Bezos responded to Musk's assertion.",
2024-11-21,Trump wants the power to single-handedly choke off government spending. Lawmakers aren't sweating it yet.,Elon Musk and Vivek Ramaswamy have said they believe the Supreme Court will grant Trump the power to refuse to spend money approved by Congress.,
2024-11-21,Elon Musk and Vivek Ramaswamy starting ‘Dogecast’ podcast about government cost-cutting,"Elon Musk and Vivek Ramaswamy are starting a podcast — or ""Dogecast"" — to keep Americans up to date on their progress at President-elect Donald Trump’s so-called Department of Government efficiency.",
2024-11-21,Musk and Ramaswamy's DOGE will work with Marjorie Taylor Greene on cost-cutting,"Elon Musk and Vivek Ramaswamy have laid out their plans for the Department of Government Efficiency (DOGE). Despite being labeled an “outside of government” group by President-elect Trump, the two say that DOGE will work closely with Congress and the executiv…",
2024-11-21,Jimmy Kimmel Says J.D. Vance Is “Chaperoning The World’s Creepiest Prom King” After He Was Spotted With Matt Gaetz In DC,"Vance is in D.C. drumming up support for Trump's cabinet picks, while the president has been making public appearances with Elon Musk.",
2024-11-21,[Removed],[Removed],
2024-11-21,Photos Show Kim Kardashian Holding Hands With Tesla Robot,"International celebrity Kim Kardashian has shared a strange series of pictures showing her hanging out with a Tesla Optimus humanoid robot sitting inside a Cybercab. It was an unusually tone-deaf series of photos, clearly intended to market her shapewear line…",
2024-11-21,Lawmakers are concerned about background checks of Trump's Cabinet picks as red flags surface,The Trump transition team so far has not signed the requisite agreements to allow the FBI to screen his personnel choices.,
2024-11-21,Bumper Stickers That Let Tesla Owners Declare They Know Elon Musk Is Mad Are Booming,"Tesla owners across America are looking to distance themselves from company boss Elon Musk after the Tesla CEO has become increasingly right-wing and, basically, batshit crazy. To do this, they’re doing the only thing any normal person would: they’re buying l…",
2024-11-21,Lawmakers are concerned about background checks of Trump's Cabinet picks as red flags surface,The Trump transition team so far has not signed the requisite agreements to allow the FBI to screen his personnel choices.,
2024-11-21,Rep. Marjorie Taylor Greene tapped to work with Elon Musk and Vivek Ramaswamy as new DOGE subcommittee chair,"Rep. Marjorie Taylor Greene, R-Ga., has been tapped to lead a new House subcommittee that will work with the so-called Department of Government Efficiency led by Elon Musk and Vivek Ramaswamy.
Greene and House Oversight Chairman James Comer, R-Ky., who aims t…",
2024-11-21,Elon Musk criticises Jaguar’s inclusive new advert amid backlash from the ‘anti-woke’ brigade,"Elon Musk criticises Jaguar’s inclusive new advert amid backlash from the ‘anti-woke’ brigade
Elon Musk has joined a pile-on from the “anti-woke” brigade, criticising a colourful and inclusive new advert from luxury car-maker Jaguar.
Released on social media …",
2024-11-21,Bullish on DOGE,"DOGE details: After a week of speculation, Elon Musk and Vivek Ramaswamy wrote in The Wall Street Journal of their plans for what the Department of",
2024-11-21,[Removed],[Removed],
2024-11-21,Rep. Marjorie Taylor Greene tapped to work with Elon Musk and Vivek Ramaswamy as new DOGE subcommittee chair,Greene's group will share the DOGE acronym with the entity commissioned by President-elect Donald Trump and led by billionaires Musk and Ramaswamy.,
2024-11-21,Bluesky chief doesn't know age limit for platform,"Jay Graber wrongly said you needed to be 18 to use Bluesky, when the actual age limit is 13.",
2024-11-21,Watch: Trump's DOGE Co-Head Vivek Ramaswamy Plays Mozart On Piano,"Vivek Ramaswamy, an Indian-origin billionaire and head co-head of US President-elect Donald Trump&#039;s Department Of Government Efficiency (DOGE), showed his skills as a pianist when he played &#039;Perahia &amp; Mozart: Perfect Match&#039;.",
2024-11-21,"Comer to create DOGE subcommittee chaired by Marjorie Taylor Greene to work with Elon Musk, Vivek Ramaswamy (Brooke Singman/Fox News)","Brooke Singman / Fox News:
Comer to create DOGE subcommittee chaired by Marjorie Taylor Greene to work with Elon Musk, Vivek Ramaswamy  —  Ramaswamy tells Fox News Digital he and his team have already met with Comer and Greene and they ‘look forward to workin…",
2024-11-21,[Removed],[Removed],
2024-11-21,Explaining the ‘Pronouns In Bio’ meme,"The Pronouns in Bio meme is a reference to the practice of putting one's pronouns in the bio of an Instagram or X profile, popularized as a way to be more inclusive of the trans community.


What is the meaning of 'pronouns in bio'?


If gender is a construct…",
2024-11-21,James Comer Taps Marjorie Taylor Greene To Chair New DOGE Subcommittee,"House Oversight Committee Chair James Comer tapped Rep. Marjorie Taylor Greene (R-GA) to chair a new subcommittee that will work with President-elect Donald Trump’s new Department of Government Efficiency (DOGE). DOGE, led by Elon Musk and Vivek Ramaswamy, al…",
2024-11-21,Musk Claims Bezos Told ‘Everyone’ To Sell Tesla Stock Before Trump’s Win—Latest In Billionaire Rivalry,"Musk’s assertion goes against the actions of the publicly apolitical Bezos this election cycle, as the Amazon chairman reportedly killed his Washington Post newspaper’s endorsement of Kamala Harris.",
2024-11-21,How Elon Musk Became a Kingmaker (Simon Shuster/Time),"Simon Shuster / Time:
How Elon Musk Became a Kingmaker  —  Hang on a minute.  Whom did we just elect?  The Republican ticket had two names at the top: Donald Trump and J.D. Vance.  But parts of this delirious November created the impression that someone else …",
2024-11-21,Greene to chair new DOGE subcommittee on Oversight next Congress | CNN Politics,House GOP Rep. Marjorie Taylor Greene announced that she will chair a new Oversight subcommittee in the next Congress that will work with the newly formed Department of Government Efficiency led by Elon Musk and Vivek Ramaswamy.,
2024-11-21,Musk And Ramaswamy’s DOGE Plans To Upend Remote Government Jobs,"Elon Musk and Vivek Ramaswamy proposed the elimination of remote work for federal employees, deeming it a residual ""privilege"" from the pandemic.",
2024-11-21,Argentina’s president gifts Giorgia Meloni chainsaw-wielding figurine of himself,Javier Milei has been promising to slash the size of the state — and sees Italy's right-wing PM as an ideological ally.,
2024-11-21,House Oversight Committee says it plans to form a subcommittee for Trump's 'Department of Government Efficiency',"WASHINGTON — The House Oversight Committee announced Thursday that Republicans plan to create a subcommittee that would work with Elon Musk and Vivek Ramaswamy on President-elect Donald Trump's recently announced advisory group, the ""Department of Government …",
2024-11-21,Are Return-To-Office Mandates About Efficiency Or Cutting Costs?,"The Department of Government Efficiency  headed by Elon Musk, is introducing new initiatives targeting remote work. And companies are doing the same.",
2024-11-21,The War on Remote Work,"The Department of Government Efficiency (DOGE), headed by Elon Musk, is introducing new initiatives targeting remote work. And companies are doing the same.",
2024-11-21,Democrats Need to Stop Defending a Broken Democratic System,"Hours before the results started coming in on November 5, when Democrats were still full of hope, the exit polls released by the major news networks contained a striking piece of data that gave supporters of Kamala Harris reason for optimism.  Voters chose th…",
2024-11-21,We Must Contest the Christian Right’s Agenda in Every Venue of Our Lives,"“It is a self-replicating authoritarian system that has persisted over the course of generations,” says Talia Lavin.",
2024-11-21,Elon Musk’s X Offsets Lost Users With 27% Spike in Post-Election Downloads,"As users flee for rivals Bluesky and Threads, X has seen its base hold steady
The post Elon Musk’s X Offsets Lost Users With 27% Spike in Post-Election Downloads appeared first on TheWrap.",
2024-11-21,"If You Take Adderall, RFK Jr. Should Probably Make You Quite Nervous","President-elect Donald Trump's pick to lead the Department of Health and Human Services, Robert F. Kennedy Jr., has a lot of dangerous opinions about healthcare — and his comments about drugs, addiction, and rehabilitation should give you pause. Earlier this …",
2024-11-21,[Removed],[Removed],
2024-11-21,Seth Meyers Scolds Dems for Turning Into Elon Musk Fanboys: ‘You’re Supposed to Be the Opposition’ | Video,"""Can't say you want to win back the working class, but also fanboy out over ... a hatchet to government programs,"" the NBC host says
The post Seth Meyers Scolds Dems for Turning Into Elon Musk Fanboys: ‘You’re Supposed to Be the Opposition’ | Video appeared f…",
2024-11-21,Meet The Most Trusted Companies In America 2025,"These are the companies trusted most by employees, customers, investors and the media.",
2024-11-21,[Removed],[Removed],
2024-11-21,[Removed],[Removed],
2024-11-21,[Removed],[Removed],
2024-11-21,[Removed],[Removed],
2024-11-21,Bullish on DOGE,"DOGE details: After a week of speculation, Elon Musk and Vivek Ramaswamy wrote in the Wall Street Journal of their plans for what the Department of Government Efficiency will actually look like. 
""Most legal edicts aren't laws enacted by Congress but 'rules a…",
2024-11-21,Which Countries Are Considering Social Media Bans For Teens?,"Social media bans for teens are being considered across the world. Newsweek looks at where they're being debated, and the concerns.",
2024-11-21,[Removed],[Removed],
2024-11-21,[Removed],[Removed],
2024-11-21,Far-Left Blowhard Cenk Uygur Turns on His Own Party After Kamala’s Humiliating Defeat — Now Groveling for a Spot in Elon Musk’s DOGE Team!,"Cenk Uygur, founder and lead host of The Young Turks, appears to have distanced himself from his party’s usual rhetoric.
The post Far-Left Blowhard Cenk Uygur Turns on His Own Party After Kamala’s Humiliating Defeat — Now Groveling for a Spot in Elon Musk’s D…",
2024-11-21,Will Republicans continue to support subsidies for the chip industry? | PwC interview,The Chips & Science Act was a bipartisan law passed to give $52 billion to the U.S. semiconductor industry. Will Republicans stand behind it?,
2024-11-21,FACT CHECK: Have Gas Prices Declined By An ‘Average Of $4 Across Red States?’,A viral post shared on Facebook claims gas prices have dropped by an average of $4.00 across “red states” in the U.S. Verdict: False The claim is false and originally stems from a Nov. 7 article published on the satire site “Esspots.com.” Fact Check: Gas stat…,
2024-11-21,Elon Musk Apparently Just Became The No. 1 ‘Diablo 4’ Player In The World,Did Elon buy his way here? Did he cheat somehow? Or is he just the world’s luckiest RNG-er and most talented Diablo 4 player?,
2024-11-21,"Self-driving vehicles rules set to loosen under Trump, report says","The Trump transition team plans to make a federal framework for self-driving vehicles a top priority for the Transportation Department, according to a report.",
2024-11-21,Zomato Reacts To Suspicious Single-Dish Restaurants On Platform; Internet Unrolls Ganja Memes,Zomato Reacts To Suspicious Single-Dish Restaurants On Platform; Internet Unrolls Ganja Memesmashable.com,
2024-11-21,Elon Musk and Vivek Ramaswamy have spelled out their plans for DOGE (Jay Peters/The Verge),"Jay Peters / The Verge:
Elon Musk and Vivek Ramaswamy have spelled out their plans for DOGE … Elon Musk and Vivek Ramaswamy were officially appointed the co-leads of President-elect Donald Trump's “Department of Government Efficiency” (DOGE) last week, and on…",
2024-11-21,US DoJ charges five alleged members of the Scattered Spider cybercrime gang,"The U.S. Justice Department charged five suspects linked to the Scattered Spider cybercrime gang with wire fraud conspiracy. The U.S. Justice Department charged five alleged members of the cybercrime gang Scattered Spider (also known as UNC3944, 0ktapus) with…",
2024-11-21,[Removed],[Removed],
